{
  "session_id": "sess_abc123",
  "timestamp": "2026-06-28T09:00:00Z",
  "bundle_hash": "a1b2c3d4e5f6a1b2c3d4e5f6a1b2c3d4e5f6a1b2c3d4e5f6a1b2c3d4e5f6a1b2",
  "dimensions": {
    "instruction_adherence": {
      "baseline_score": 71,
      "harness_score": 44,
      "delta": -27,
      "status": "NEEDS_PATCH",
      "root_cause": "System prompt contains two contradictory instructions: 'always respond formally' and 'respond conversationally to greetings'. The model defaults to the latter, violating the former.",
      "fixable": true,
      "structural_reason": null,
      "fix_type": "system_prompt",
      "test_cases_run": 8,
      "latency_baseline_ms": null,
      "latency_harness_ms": null
    },
    "tool_accuracy": {
      "baseline_score": 72,
      "harness_score": 31,
      "delta": -41,
      "status": "NEEDS_PATCH",
      "root_cause": "Tool definition for get_order lacks an enum or format constraint on order_id. The model produces plausible-looking but incorrect order id formats 70% of the time.",
      "fixable": true,
      "structural_reason": null,
      "fix_type": "tool_definition",
      "test_cases_run": 10,
      "latency_baseline_ms": null,
      "latency_harness_ms": null
    },
    "output_format": {
      "baseline_score": 88,
      "harness_score": 85,
      "delta": -3,
      "status": "PASSING",
      "root_cause": null,
      "fixable": true,
      "structural_reason": null,
      "fix_type": null,
      "test_cases_run": 6,
      "latency_baseline_ms": null,
      "latency_harness_ms": null
    },
    "skill_trigger": {
      "baseline_score": 60,
      "harness_score": 52,
      "delta": -8,
      "status": "NEEDS_PATCH",
      "root_cause": "The 'escalate' skill trigger is too broad — it fires on any mention of money, not just billing disputes. Causes false-positive escalations on pricing questions.",
      "fixable": true,
      "structural_reason": null,
      "fix_type": "skill",
      "test_cases_run": 8,
      "latency_baseline_ms": null,
      "latency_harness_ms": null
    },
    "latency_delta": {
      "baseline_score": 90,
      "harness_score": 74,
      "delta": -16,
      "status": "NEEDS_PATCH",
      "root_cause": "Harness adds ~340ms overhead per call due to prepending all skill files regardless of relevance.",
      "fixable": true,
      "structural_reason": null,
      "fix_type": "skill",
      "test_cases_run": 0,
      "latency_baseline_ms": 410,
      "latency_harness_ms": 750
    },
    "error_recovery": {
      "baseline_score": 38,
      "harness_score": 35,
      "delta": -3,
      "status": "STRUCTURAL_LIMITATION",
      "root_cause": "Model consistently fails to self-correct malformed JSON tool calls. No harness-level skill can reliably prompt self-correction of this failure mode.",
      "fixable": false,
      "structural_reason": "Self-correction of malformed tool calls requires the model to recognise its own output error. This is a model-capability ceiling — the harness cannot supply a recovery path the model does not have the capacity to execute. Fix: upgrade to a model with stronger tool-use self-correction, or add a post-processing validation layer in the application code.",
      "fix_type": null,
      "test_cases_run": 7,
      "latency_baseline_ms": null,
      "latency_harness_ms": null
    }
  },
  "summary": {
    "dimensions_passing":    ["output_format"],
    "dimensions_failing":    ["instruction_adherence", "tool_accuracy", "skill_trigger", "latency_delta"],
    "dimensions_structural": ["error_recovery"]
  },
  "patch_history": []
}
